model_category,dataset_num,dataset_name,dataset_external_id,description,frequency,forecast_length,use_dataset,is_smoke_test,encoding
forecasting,113,M4 Forecasting Competition Sampled Monthly Series Ratio 10x,m4_monthly_miscellaneous_ratio_10,"This is a variation of the M4 Forecasting Competition Sampled Monthly Series dataset. It is filtered to limit the history to be 10x the forecast length which is 12 time steps. This dataset comprises 80 timeseries at monthly frequency, each spanning 324 months, randomly sampled from the M4 forecasting competition. These series provide a consistent length of historical window and are ideal for exploring long-term trends and seasonalities. The M4 dataset contains series drawn from across various sectors.",MONTHLY,12,1,0,utf-8
forecasting,114,M4 Forecasting Competition Sampled Quarterly Series Ratio 10x,m4_quarterly_miscellaneous_ratio_10,"This is a variation of the M4 Forecasting Competition Sampled Quarterly Series dataset. It is filtered to limit the history to be 10x the forecast length which is 8 time steps. This dataset comprises 75 quarterly time series, each spanning March 1998 to June 2017, randomly sampled from the M4 forecasting competition. These series provide a consistent historical window and are ideal for exploring long-term trends and forecasting challenges on quarterly-frequency series drawn from across various sectors.",QUARTERLY,8,1,0,utf-8
forecasting,115,M4 Forecasting Competition Sampled Yearly Series Ratio 10x,m4_yearly_miscellaneous_ratio_10,"This is a variation of the M4 Forecasting Competition Sampled Yearly Series dataset. It is filtered to limit the history to be 10x the forecast length which is 3 time steps. This dataset comprises 100 yearly time series, each spanning 46 years from 1970 to 2015, meticulously sampled from the M4 forecasting competition. These series provide a consistent historical window and are ideal for exploring long-term trends and forecasting challenges across various sectors.",YEARLY,3,1,0,utf-8
forecasting,116,Online Retail Sales Ratio 10x,online_retail_sales_ratio_10,"This is a variation of the Online Retail Sales dataset. It is filtered to limit the history to be 10x the forecast length which is 28 time steps. The `Online Retail Sales` dataset aggregates daily transactions from a UK-based online retailer, focusing on the top 40 items by sales over a two-year period from 2018 to 2019. It provides insights into daily order counts and total sales per item, offering a granular view of consumer purchasing patterns and item performance within the niche market of unique all-occasion gifts. This dataset is particularly useful for retail trend analysis, inventory forecasting, and understanding seasonal impacts on e-commerce.",DAILY,28,1,0,utf-8
forecasting,117,PJM Hourly Energy Consumption Ratio 10x,pjm_energy_consumption_ratio_10,This is a variation of the PJM Hourly Energy Consumption dataset. It is filtered to limit the history to be 10x the forecast length which is 72 time steps. This dataset contains data related to hourly level energy consumption in regions served by PJM Interconnection LLC (PJM). ,HOURLY,72,1,0,utf-8
forecasting,118,Seattle Burke Gilman Trail Ratio 10x,seattle_burke_gilman_trail_ratio_10,"This is a variation of the Seattle Burke Gilman Trail dataset. It is filtered to limit the history to be 10x the forecast length which is 72 time steps. This dataset contains hourly level pedestrian and bicycle counts at the Burke Gilman Trail in Seattle. 
There are a total of 4 series in the dataset for the pedestrian and bike counts in each direction (north-bound and south-bound). The data is filtered to cover the date range from 1/1/2017 to 7/31/2017. This dataset is useful for timeseries analysis involving short-term seasonalities, especially intra-day (hour-of-the-day) and intra-week (day-of-the-week) seasonalities. The dataset contains some extreme outliers, presumably due to one-off special events at the trail locations. ",HOURLY,72,1,0,utf-8
forecasting,119,Sunspots Ratio 10x,sunspots_quarterly_ratio_10,"This is a variation of the Sunspots dataset. It is filtered to limit the history to be 10x the forecast length which is 8 time steps. The Sunspots dataset consists of observations of the number of sunspots on the Sun, recorded each month. It spans the time period from January 1749 to December 1983, providing a long-term view of solar activity. This dataset is invaluable for time series analysis and forecasting due to its longevity, regularity, and the clear cyclical patterns it presents, which are reflective of the approximately 11-year solar cycle. Researchers and analysts commonly use this dataset to practice and test forecasting models, including ARIMA, exponential smoothing, and more modern machine learning approaches. The dataset's extensive history makes it particularly suitable for studying long-term trends and cyclic behavior in solar activity, offering insights into past solar cycles and helping predict future solar phenomena.",QUARTERLY,8,1,0,utf-8
forecasting,120,Theme Park Attendance Ratio 10x,theme_park_attendance_ratio_10,"This is a variation of the Theme Park Attendance dataset. It is filtered to limit the history to be 10x the forecast length which is 28 time steps. This dataset represents synthetic daily attendance at a fictitious theme park in Los Angeles from 2016 to 2019. It is ideal for time series forecasting, showcasing the impact of annual and weekly seasonality, exogenous variables such as holidays and weather, and random fluctuations on attendance numbers.",DAILY,28,1,0,utf-8
